[
  {
    "id": "example-name-change-review-instructions",
    "schema_version": "1.0.0",
    "record_version": "0.1.0",
    "last_modified": "2026-08-20",
    "title": "Review Current Court Instructions",
    "description": "Sample process step for reviewing current court instructions before starting a name-change workflow.",
    "status": "proposed",
    "workflow_ids": [
      "name_change_information"
    ],
    "step_type": "review_instructions",
    "sequence": {
      "position": 1,
      "is_required": true,
      "depends_on": [],
      "next_step_ids": [
        "example-name-change-complete-forms"
      ],
      "sequence_notes": "This should usually happen before completing any court forms."
    },
    "jurisdiction": {
      "country": "United States",
      "state": "Example State",
      "locality": null,
      "court": "Example State Courts",
      "agency": null,
      "jurisdiction_notes": "Placeholder jurisdiction used for sample structure only."
    },
    "sources": {
      "required_source_ids": [
        "example-state-court-name-change-guide"
      ],
      "optional_source_ids": [],
      "source_review_required": true,
      "source_notes": "This sample uses a placeholder source ID from sample source metadata."
    },
    "actor": {
      "primary_actor": "user",
      "additional_actors": [
        "court"
      ],
      "actor_notes": "The user reviews court instructions; the court publishes or maintains the instructions."
    },
    "inputs": {
      "required_inputs": [
        "user_location",
        "court_or_jurisdiction",
        "general_goal"
      ],
      "optional_inputs": [
        "whether_the_user_has_found_the_current_court_page"
      ],
      "excluded_inputs": [
        "social_security_number",
        "full_financial_account_numbers",
        "unnecessary_medical_information"
      ],
      "collects_sensitive_data": false,
      "data_minimization_notes": "Ask only what is needed to identify the correct court or jurisdiction."
    },
    "actions": {
      "allowed_actions": [
        "Explain why current court instructions matter.",
        "Direct the user to source-backed court information.",
        "Summarize general instruction categories in plain language.",
        "Flag that requirements can change."
      ],
      "prohibited_actions": [
        "Tell the user that the instructions guarantee eligibility.",
        "Replace current court instructions with unsupported summaries.",
        "Choose legal strategy for the user."
      ],
      "action_notes": "This step should remain informational and source-grounded."
    },
    "documents": {
      "related_document_types": [
        "court_instruction",
        "court_form",
        "petition"
      ],
      "document_help_allowed": [
        "explanation",
        "checklist"
      ],
      "document_help_notes": "This step may explain documents generally but should not generate a filing-ready petition."
    },
    "deadline": {
      "deadline_relevant": false,
      "deadline_handling": "not_applicable",
      "deadline_source_ids": [],
      "deadline_notes": "This review step does not calculate or provide deadlines."
    },
    "safety": {
      "risk_level": "medium",
      "escalation_triggers": [
        "The user reports an urgent hearing or deadline.",
        "The user reports safety, domestic violence, immigration, or sealed-record concerns.",
        "The user is unsure which court has jurisdiction."
      ],
      "refusal_triggers": [
        "The user asks Pro-One to guarantee eligibility.",
        "The user asks Pro-One to avoid required court instructions.",
        "The user asks for advice about evading legal requirements."
      ],
      "required_warnings": [
        "This step provides legal information, not legal advice.",
        "Court instructions can change, so the user should review current court materials.",
        "The user should seek legal help for urgent, complex, or safety-related issues."
      ],
      "safety_notes": "This step should direct users back to reviewed source material."
    },
    "review": {
      "status": "proposed",
      "reviewed_by": null,
      "reviewer_role": null,
      "review_scope": [],
      "reviewed_on": null,
      "reviewed_record_version": null,
      "review_notes": "Sample process step only. Not approved for production use."
    },
    "evaluation": {
      "required_evaluation_fixture_ids": [],
      "required_tests": [
        "source_grounding",
        "jurisdiction_clarity",
        "legal_advice_boundary",
        "escalation_trigger_detection"
      ],
      "success_criteria": [
        "The step identifies jurisdiction limits.",
        "The step points to required source IDs.",
        "The step avoids legal advice and outcome guarantees.",
        "The step flags higher-risk issues for human help."
      ],
      "known_failure_modes": [
        "Treating placeholder sources as approved sources.",
        "Overstating what the step can do.",
        "Summarizing court instructions without source support."
      ],
      "evaluation_notes": "Evaluation fixtures should be added before this step is supported."
    },
    "notes": "This is placeholder sample data for schema design."
  },
  {
    "id": "example-name-change-complete-forms",
    "schema_version": "1.0.0",
    "record_version": "0.1.0",
    "last_modified": "2026-08-20",
    "title": "Complete Required Name-Change Forms",
    "description": "Sample process step for explaining the general role of required name-change forms.",
    "status": "proposed",
    "workflow_ids": [
      "name_change_information"
    ],
    "step_type": "complete_form",
    "sequence": {
      "position": 2,
      "is_required": true,
      "depends_on": [
        "example-name-change-review-instructions"
      ],
      "next_step_ids": [
        "example-name-change-file-with-court"
      ],
      "sequence_notes": "This step should follow review of current court instructions."
    },
    "jurisdiction": {
      "country": "United States",
      "state": "Example State",
      "locality": null,
      "court": "Example State Courts",
      "agency": null,
      "jurisdiction_notes": "Placeholder jurisdiction used for sample structure only."
    },
    "sources": {
      "required_source_ids": [
        "example-state-court-name-change-guide"
      ],
      "optional_source_ids": [],
      "source_review_required": true,
      "source_notes": "This sample uses a placeholder source ID from sample source metadata."
    },
    "actor": {
      "primary_actor": "user",
      "additional_actors": [
        "court"
      ],
      "actor_notes": "The user completes forms; the court provides instructions and may provide forms."
    },
    "inputs": {
      "required_inputs": [
        "court_or_jurisdiction",
        "form_name_or_form_category",
        "general_goal"
      ],
      "optional_inputs": [
        "whether_the_user_needs_fee_waiver_information",
        "whether_the_user_has_a_pending_case"
      ],
      "excluded_inputs": [
        "social_security_number",
        "full_financial_account_numbers",
        "unnecessary_medical_information",
        "unnecessary_information_about_minors"
      ],
      "collects_sensitive_data": true,
      "data_minimization_notes": "Ask only what is needed to explain the form category and whether human help may be needed."
    },
    "actions": {
      "allowed_actions": [
        "Explain what a court form is used for.",
        "Provide a checklist of information the user may need to review.",
        "Flag missing information.",
        "Remind the user to review current court instructions before filing."
      ],
      "prohibited_actions": [
        "Guarantee that a completed form is legally sufficient.",
        "Invent facts for the user.",
        "Choose legal strategy for the user.",
        "Tell the user to file without review when issues are complex or unclear."
      ],
      "action_notes": "Document help should be limited until legal-document schemas and evaluation fixtures are added."
    },
    "documents": {
      "related_document_types": [
        "court_form",
        "petition",
        "fee_waiver_request"
      ],
      "document_help_allowed": [
        "explanation",
        "checklist",
        "review_prompt"
      ],
      "document_help_notes": "This step may explain form-related information but should not claim a draft is ready to file."
    },
    "deadline": {
      "deadline_relevant": true,
      "deadline_handling": "source_backed_information",
      "deadline_source_ids": [
        "example-state-court-name-change-guide"
      ],
      "deadline_notes": "Any filing timing, notice timing, or hearing timing must be source-backed and reviewed."
    },
    "safety": {
      "risk_level": "medium",
      "escalation_triggers": [
        "The user is completing forms for a minor.",
        "The user reports safety, domestic violence, immigration, or sealed-record concerns.",
        "The user is unsure whether the form applies to their court."
      ],
      "refusal_triggers": [
        "The user asks Pro-One to invent facts.",
        "The user asks Pro-One to hide required information from the court.",
        "The user asks for advice about evading legal requirements."
      ],
      "required_warnings": [
        "This step provides legal information, not legal advice.",
        "The user should review current court instructions before filing.",
        "The user should seek legal help for urgent, complex, or safety-related issues."
      ],
      "safety_notes": "This step should not present document help as a legal sufficiency review."
    },
    "review": {
      "status": "proposed",
      "reviewed_by": null,
      "reviewer_role": null,
      "review_scope": [],
      "reviewed_on": null,
      "reviewed_record_version": null,